{
  "$schema": "https://json-schema.org/draft/2020-12/schema",
  "$id": "https://local/desktop-automation-agent/plan.schema.json",
  "title": "DesktopAutomationAgent Plan Manifest",
  "type": "object",
  "required": [
    "schemaVersion",
    "catalogSchemaVersion",
    "planId",
    "name",
    "steps"
  ],
  "additionalProperties": false,
  "properties": {
    "$schema": {
      "type": "string"
    },
    "schemaVersion": {
      "const": 1
    },
    "catalogSchemaVersion": {
      "const": 2
    },
    "planId": {
      "type": "string",
      "pattern": "^[A-Za-z0-9][A-Za-z0-9._-]{0,127}$"
    },
    "name": {
      "type": "string",
      "minLength": 1
    },
    "description": {
      "type": "string"
    },
    "tags": {
      "type": "array",
      "items": {
        "type": "string"
      }
    },
    "metadata": {
      "type": "object",
      "additionalProperties": true
    },
    "steps": {
      "type": "array",
      "minItems": 1,
      "maxItems": 1000,
      "items": {
        "$ref": "#/$defs/mainStep"
      }
    },
    "onFailureSteps": {
      "type": "array",
      "maxItems": 999,
      "items": {
        "$ref": "#/$defs/cleanupStep"
      }
    }
  },
  "$defs": {
    "mainStep": {
      "type": "object",
      "required": [
        "id",
        "operation",
        "arguments"
      ],
      "additionalProperties": false,
      "properties": {
        "id": {
          "type": "string",
          "minLength": 1
        },
        "operation": {
          "type": "string",
          "minLength": 1,
          "pattern": "^\\S(.*\\S)?$"
        },
        "arguments": {
          "type": "object",
          "additionalProperties": true,
          "propertyNames": {
            "not": {
              "anyOf": [
                {
                  "pattern": "(?i)^operation$"
                },
                {
                  "pattern": "(?i)^authorization$"
                },
                {
                  "pattern": "(?i)^bearertoken$"
                }
              ]
            }
          }
        },
        "assertions": {
          "type": "array",
          "items": {
            "$ref": "#/$defs/planAssertion"
          }
        },
        "sensitive": {
          "type": "boolean",
          "default": false
        },
        "captureResponse": {
          "type": "boolean",
          "default": false
        }
      }
    },
    "cleanupStep": {
      "type": "object",
      "required": [
        "id",
        "operation",
        "arguments"
      ],
      "additionalProperties": false,
      "properties": {
        "id": {
          "type": "string",
          "minLength": 1
        },
        "operation": {
          "type": "string",
          "minLength": 1,
          "pattern": "^\\S(.*\\S)?$"
        },
        "arguments": {
          "type": "object",
          "additionalProperties": true,
          "propertyNames": {
            "not": {
              "anyOf": [
                {
                  "pattern": "(?i)^operation$"
                },
                {
                  "pattern": "(?i)^authorization$"
                },
                {
                  "pattern": "(?i)^bearertoken$"
                }
              ]
            }
          }
        },
        "sensitive": {
          "type": "boolean",
          "default": false
        }
      }
    },
    "planAssertion": {
      "type": "object",
      "required": [
        "operator"
      ],
      "additionalProperties": false,
      "properties": {
        "path": {
          "type": "string",
          "default": ""
        },
        "operator": {
          "type": "string",
          "enum": [
            "equals",
            "notEquals",
            "contains",
            "matchesRegex",
            "isTrue",
            "isFalse",
            "isNull",
            "isNotNull"
          ]
        },
        "expected": {},
        "ignoreCase": {
          "type": "boolean",
          "default": false
        }
      },
      "allOf": [
        {
          "if": {
            "properties": {
              "operator": {
                "enum": [
                  "equals",
                  "notEquals",
                  "contains",
                  "matchesRegex"
                ]
              }
            },
            "required": [
              "operator"
            ]
          },
          "then": {
            "required": [
              "operator",
              "expected"
            ]
          }
        }
      ]
    }
  },
  "$comment": "Combined length of steps and onFailureSteps must be <= 1000 (enforced by DesktopAutomationAgent PlanValidator). Reserved argument names are rejected case-insensitively by PlanValidator; the propertyNames patterns below mirror that rule for common casings."
}
